<?xml version="1.0" encoding="UTF-8"?>
<!DOCTYPE databases SYSTEM "http://myphpframework.com/dtd/database.dtd" >
<databases>
   <server engine="MySQLi">
       <host>localhost</host>
       <port>3306</port>
       <access type="rw" for="1">
           <database>test</database>
           <login>test</login>
           <password>test</password>
       </access>
   </server>
   <server engine="PostgreSQL">
       <host>localhost</host>
       <port>5432</port>
       <access type="rw" for="2">
           <database>test</database>
           <login>test</login>
           <password>test</password>
       </access>
   </server>
   <server engine="SQLite">
       <host>/var/www/sqliteDb/</host>
       <port>010</port>
       <access type="rw" for="2">
           <database>test</database>
           <login>test</login>
           <password>test</password>
       </access>
   </server>
</databases>
