<?xml version="1.0" encoding="UTF-8"?>
<!DOCTYPE config SYSTEM "http://myphpframework.com/dtd/database.dtd" >
<databases>
   <server engine="BOBISNOTANENGINE">
       <host>localhost</host>
       <port>3306</port>
       <access type="rw" for="1">
           <database>newbiverse</database>
           <login>root</login>
           <password>124357</password>
       </access>
   </server>
   <server engine="BOBISNOTANENGINE">
       <host>localhost</host>
       <port>3306</port>
       <access type="r" for="2">
           <database>newbiverse</database>
           <login>root</login>
           <password>124357</password>
       </access>
       <access type="w" for="1">
           <database>newbiverse</database>
           <login>root</login>
           <password>124357</password>
       </access>
   </server>
</databases>
